Leela-Zero/leelaz_opencl_tuning
0;XgemmBatched;128;100;128;16; -DKWG=32 -DKWI=2 -DMDIMA=16 -DMDIMC=16 -DMWG=32 -DNDIMB=8 -DNDIMC=8 -DNWG=16 -DSA=1 -DSB=1 -DSTRM=0 -DSTRN=0 -DVWM=2 -DVWN=2;OpenCL: Advanced Micro Devices, Inc. gfx900 @ 1622MHz
